{
  "duration": 3.2,
  "fps": 30,
  "captionMode": "subtitles",
  "designSystem": "state/design-system.json",
  "beats": [
    {
      "id": "support-001",
      "sceneId": "supporting-showcase",
      "sourceSegmentIds": ["seg-001"],
      "text": "关键帧 / GSAP",
      "start": 0,
      "end": 1.5,
      "audioAnchorTime": 0,
      "axis": "B",
      "recipe": "b-axis-showcase",
      "mgScope": "local",
      "captionSafeZonePass": true,
      "intent": "Add technical context without repeating the subtitle",
      "onScreenCopy": ["关键帧", "GSAP"],
      "captionCueIds": ["caption-0001"],
      "visualStyle": "两个依赖模块沿一条连接路径依次锁定。",
      "primaryFlowAxis": "horizontal",
      "visualReference": "proposal:linked-dependency-modules",
      "viewerQuestion": "How are the two animation systems related?",
      "supportRole": "organization",
      "removalLoss": "The viewer loses the relationship between the keyframe and runtime layers.",
      "visualEncoding": "Two connected modules activate in dependency order.",
      "stillFrameValue": "The linked modules still show that keyframes define the sequence and GSAP runs it.",
      "attentionCost": "medium",
      "factualClaims": [],
      "terms": [
        { "term": "关键帧", "plainExplanation": "预先定义动画状态和变化时点。" },
        { "term": "GSAP", "plainExplanation": "在网页中按时间表执行动画的工具。" }
      ],
      "motionFamily": "technical",
      "transitionFamily": "module-build",
      "microEvents": [
        { "time": 0.8, "type": "module-activate", "semanticChange": "GSAP orbit activates" }
      ],
      "layout": {
        "primaryOccupancyRatio": 0.38,
        "primaryBoundsNormalized": { "x": 0.08, "y": 0.22, "width": 0.84, "height": 0.38 },
        "supportingElementCount": 2,
        "emptyComponentCount": 0,
        "panelPaddingPx": 56,
        "safeAreaPass": true,
        "faceCover": "partial"
      },
      "typography": {
        "fontFamily": "Smiley Sans",
        "role": "primary",
        "fontSizePx": 104,
        "lineHeight": 0.98,
        "maxLines": 2,
        "outlineReservePx": 20
      },
      "components": ["keyframe module", "GSAP orbit"],
      "entranceFrames": 10,
      "exitFrames": 8
    },
    {
      "id": "support-002",
      "sceneId": "supporting-showcase",
      "sourceSegmentIds": ["seg-002"],
      "text": "30 FPS / 实时同步",
      "start": 1.5,
      "end": 3.2,
      "audioAnchorTime": 1.5,
      "axis": "B",
      "recipe": "b-axis-showcase",
      "mgScope": "local",
      "captionSafeZonePass": true,
      "intent": "Explain animation playback quality without duplicating the subtitle",
      "onScreenCopy": ["30 FPS", "实时同步"],
      "captionCueIds": ["caption-0002"],
      "visualStyle": "帧尺与同步指针沿同一时间轴校准。",
      "primaryFlowAxis": "horizontal",
      "visualReference": "proposal:timeline-sync-indicator",
      "viewerQuestion": "What makes the playback stay synchronized?",
      "supportRole": "explanation",
      "removalLoss": "The viewer loses the causal link between frame cadence and synchronization.",
      "visualEncoding": "Frame bars resolve into a stable synchronization indicator.",
      "stillFrameValue": "The resolved indicator still shows that the composition follows the source frame rate.",
      "attentionCost": "medium",
      "factualClaims": [],
      "terms": [
        { "term": "30 FPS", "plainExplanation": "每秒由 30 个画面组成。" }
      ],
      "motionFamily": "technical",
      "transitionFamily": "semantic-morph",
      "microEvents": [
        { "time": 2.35, "type": "status-update", "semanticChange": "frame-rate status resolves" }
      ],
      "layout": {
        "primaryOccupancyRatio": 0.4,
        "primaryBoundsNormalized": { "x": 0.08, "y": 0.22, "width": 0.84, "height": 0.4 },
        "supportingElementCount": 2,
        "emptyComponentCount": 0,
        "panelPaddingPx": 56,
        "safeAreaPass": true,
        "faceCover": "partial"
      },
      "typography": {
        "fontFamily": "Smiley Sans",
        "role": "primary",
        "fontSizePx": 104,
        "lineHeight": 0.98,
        "maxLines": 2,
        "outlineReservePx": 20
      },
      "components": ["FPS bars", "sync indicator"],
      "entranceFrames": 8,
      "exitFrames": 8
    }
  ]
}
